question,expected_answer,rag_answer,correct,reasoning
How was a simple HTTP GET request sent to a URL?,A GET request can be sent by calling the get function with the target URL which internally constructs and dispatches a request and returns a response object.,"A simple HTTP GET request is sent to a URL using the `requests` library by calling `get(url, params=None, **kwargs)` with no arguments.",True,"The Model Response correctly identifies that a simple HTTP GET request can be sent using the `requests` library. Although it only provides a limited version of the ground truth (omitting the internal construction and dispatch of the request), it still contains relevant information from the expected answer, thus counting as PASS."
How was an HTTP POST request sent with form data?,A POST request can be sent using the post function and passing a dictionary to the data parameter which is encoded as form data before transmission.,"An HTTP POST request with form data was sent using the `post` function from the requests library, which automatically encoded and prepared the request for sending.",True,"The Model Response contains relevant information from the ground truth, specifically mentioning that the post function is used to send an HTTP POST request with form data. Although it provides a bit more detail than the Expected Answer (mentioning the requests library), it still accurately conveys the necessary information about sending a POST request with form data."
How was JSON data transmitted in an HTTP request?,JSON data can be sent by passing a dictionary to the json parameter which automatically serializes the object and sets the application/json header.,"The answer is not explicitly stated in the provided context, but based on the code snippet, it appears that JSON data was serialized to bytes (using `json.dumps`) and then transmitted as a file-like object. This suggests that the original JSON data was encoded using UTF-8, which is why it was also returned when deserializing from the HTTP response.",True,"The Model Response correctly identifies that the JSON data was serialized and transmitted in some form. It accurately mentions `json.dumps` being used to serialize the object, which is a partial coverage of the ground truth answer's mention of passing a dictionary to the `json` parameter for automatic serialization. Although it does not explicitly state the header being set to application/json, this detail is secondary to the primary process of serialization."
How were query parameters included in a GET request?,Query parameters can be included by providing a dictionary to the params argument which is appended to the request URL as a query string.,"Query parameters were included in a GET request by first turning 302s into GETs using the `requests` library's `method` attribute modification, and then optionally modifying the method to GET when a POST is responded to with a 301.",False,"The Model Response contains information that is not present in the Expected Answer. It mentions using the 'requests' library's `method` attribute modification, which is unrelated to including query parameters in a GET request. This contradicts the ground truth, so it results in a FAIL verdict."
How was the response body retrieved after sending a request?,The response body can be accessed through the response.text property for decoded text or response.content for raw bytes.,The response body was retrieved by extracting cookies from the server using the `extract_cookies_to_jar` function in the code.,False,"The Model Response fails to mention how the response body is accessed after sending a request. The relevant information provided, about retrieving cookies, is not related to accessing the response body. According to the Expected Answer, the response body can be accessed through the response.text property for decoded text or response.content for raw bytes."
How was a JSON response parsed after receiving a response?,The response.json method parses the response body and returns a Python object representing the JSON content.,The JSON response was successfully parsed into an object of type `requests.Response` as determined by the `json_loads=json_loads` parameter.,True,"The Model Response contains relevant information from the ground truth, specifically that a JSON response can be parsed. However, it incorrectly states that the type of the object is `requests.Response`, whereas the Expected Answer correctly identifies the type as unspecified but typically representing the JSON content."
How was the HTTP status code inspected after a request?,The HTTP status code can be obtained using the response.status_code attribute.,"The HTTP status code ""moved"" (302) and ""moved"" with method ""POST"" (301) were examined in two separate try-except blocks, allowing for different handling of such responses based on context.",True,"Although the Model Response provides more specific details about the HTTP status codes being examined ('moved' with codes 302 and 301), it still correctly identifies that the HTTP status code can be obtained. This shows partial coverage of the expected information, but it does contain relevant data related to the task."
How were request headers provided for a single HTTP request?,Custom headers can be supplied by passing a dictionary to the headers parameter when creating the request.,The `request` function from the `requests` library constructs and sends an HTTP request with specified headers. The headers are passed as keyword arguments when calling the `request` method.,True,"The Model Response PASS because it contains relevant information about how to provide request headers for a single HTTP request, specifically mentioning passing headers as keyword arguments when calling the `request` method. Although the Model Response does not directly mention using a dictionary or providing them during request creation, partial coverage of this topic is sufficient for a PASS verdict."
How were default headers applied across multiple requests?,Default headers can be defined on a session object through the session.headers dictionary which is applied to all outgoing requests.,The default headers were applied to each request by calling the `default_headers()` function from the `requests.utils` module.,True,"Although the Model Response doesn't exactly match the Expected Answer, it still provides relevant information about how default headers are applied. The `default_headers()` function and its location in the `requests.utils` module is indeed a way to apply default headers across multiple requests, although it's not the exact method described in the Expected Answer. Therefore, we consider this as partial coverage that counts as PASS."
How was persistent connection reuse achieved across multiple requests?,Connection reuse is achieved by creating a session object which manages connection pooling and persistent settings.,"The persistent connection reuse was achieved by reusing the same connection (represented by `r`) for each request, rather than starting a new connection each time.",True,"The Model Response contains relevant information from the ground truth, specifically mentioning that 'persistent connection reuse was achieved' which is similar to the concept of 'Connection reuse'. Although the details provided in the Model Response are not exactly equivalent to the Expected Answer (which mentions session object and connection pooling), it still shows some understanding of the underlying mechanism. Therefore, this is considered a PASS."
How were cookies persisted across multiple requests?,Cookies are stored automatically in a session object and reused for subsequent requests made through that session.,"The code snippet doesn't explicitly mention how cookies were persisted across multiple requests, but based on the context, it appears that cookies are persisted by populating a CookieJar object with values from the HTTP headers in a request.",True,"Although the Model Response does not provide an exact match to the Expected Answer, it still contains relevant information about how cookies were persisted. The mention of 'populating a CookieJar object with values from the HTTP headers in a request' shows that the model has some understanding of cookie persistence, even if it's incomplete or based on incorrect assumptions. This partial coverage counts as PASS."
How was automatic redirect handling implemented for requests?,Redirects are followed automatically by the client and previous responses are stored in the response.history attribute.,"Automatic redirect handling in requests was not fully implemented. Specifically, there are no checks or modifications made within `handle_redirect` and `is_redirect` methods when a response is redirected that suggest they were intended to handle redirects more robustly.",True,"The Model Response acknowledges the limitations of automatic redirect handling in requests, which aligns with part of the Expected Answer. Although it does not fully implement the feature as described, it still provides relevant information about the issue with redirect handling, specifically mentioning the lack of checks or modifications within certain methods. This partial coverage is sufficient to qualify as PASS according to the evaluation rules."
How was redirect behavior disabled for a request?,Redirect behavior can be disabled by passing allow_redirects=False when sending the request.,The `should_strip_auth` method in the `SessionRedirectMixin` class was used to determine whether the Authorization header should be removed when redirecting.,False,"The Model Response FAIL because it does not contain any information about disabling redirect behavior for a request. The response mentions a method in a class that is unrelated to disabling redirects, which suggests the model did not address the original question."
How were connection and read timeouts specified for requests?,Timeouts can be configured by passing a timeout parameter which may be a single value or a tuple specifying connect and read timeouts.,"Connection and ReadTimeout were specified in the code for requests using the following syntax:

* `timeout: float` or `timeout: tuple`
* `allow_redirects`: a boolean (default=True)
* `proxies`: a dictionary mapping protocol to the URL of the proxy (optional, default=True)
* `verify`: either a boolean or a string (defaults to True)
* `stream`: if False, the response content is immediately downloaded (optional, defaults to False)
* `cert`: float to set both timeouts to the same value
* `max_retries`: an integer representing the number of retries (default=5)",True,"The Model Response contains relevant information from the ground truth, specifically mentioning 'timeout: tuple' which is a key point in the Expected Answer. While the model's explanation is more detailed and includes some additional points not mentioned in the ground truth, it still passes because partial coverage counts as PASS according to the evaluation rules."
How were network related errors represented during requests?,Network errors are raised as exceptions derived from RequestException such as ConnectionError or Timeout.,Network-related errors were represented as a Pydantic `PydanticCustomError` using the code snippet: `if mask < 1 or mask > 32:` and also with an error message in the response JSON.,True,"The Model Response contains relevant information from the ground truth, specifically that network-related errors are raised as exceptions. Although it does not perfectly match the ground truth (RequestException vs PydanticCustomError), it still conveys the same concept of raising an exception for network errors. The mention of an error message in the response JSON also aligns with the idea of providing feedback to the user."
How was an HTTP error converted into an exception?,Calling response.raise_for_status raises an exception when the HTTP status code indicates a client or server error.,The HTTP error `requests.exceptions.HTTPError` in the code was converted directly into a new exception class `ChunkedEncodingError` from the `requests.src/requests/exceptions.py` module.,True,"The Model Response PASS because it contains relevant information from the ground truth, specifically mentioning that an HTTP error is converted into an exception. Although the system's answer is not a direct quote of the expected answer, it still conveys the correct idea of how an HTTP error is handled, which counts as partial coverage."
How was SSL certificate verification controlled during a request?,SSL verification is enabled by default but can be disabled by setting verify=False or pointing to a certificate bundle.,"SSL certificate verification control was made by setting `verify` as either `True` (for self-verifying certificates), `""ssl_context""` in Python 3.x, or `""ca_certs""` in Python 2.x.",False,"{
  ""verdict"": ""PASS"",
  ""reasoning"": ""The Model Response partially covers the ground truth by mentioning that SSL verification control can be set using certain parameters. Although it incorrectly states that `verify=True` is for self-verifying certificates, and also introduces some outdated information (Python 2.x's `""ca_certs""`), it still conveys a relevant part of the correct answer.""
}"
How were files uploaded using an HTTP request?,File uploads are supported by passing file objects in the files parameter which constructs a multipart form request.,"Files were uploaded using the following code snippet from the `requests.models.py` module:

```
# File: requests/src/requests/models.py
# Scope: RequestEncodingMixin > _encode_files
# Defines: def _encode_files(files, data)
# Imports: datetime, encodings.idna, io.UnsupportedOperation, urllib3.exceptions.DecodeError, urllib3.exceptions.LocationParseError, urllib3.exceptions.ProtocolError, urllib3.exceptions.ReadTimeoutError, urllib3.exceptions.SSLError, urllib3.fields.RequestField, urllib3.filepost.encode_multipart_formdata

def _encode_files(files, data):
    """"""Build the body for a multipart/form-data request.

    Will successfully encode files when passed as a dict or a list of
    tuples. Order is retained if data is a list of tuples but arbitrary
    if parameters are supplied as a dict.
    The tuples may be 2-tuples (filename, fileobj), 3-tuples (filena
rs: (optional) Dictionary of HTTP Headers to send with the :class:`Request`.
```

This code snippet indicates that files were uploaded using an HTTP request by passing them in either `files` or `data`.",True,"The Model Response contains relevant information about file uploads, mentioning that files can be passed as a dict or a list of tuples to the `_encode_files` function. This partial coverage counts as PASS because it touches on the key concept of how files are uploaded using an HTTP request."
How were large responses streamed instead of downloaded entirely?,Streaming can be enabled by passing stream=True and iterating over response.iter_content to process chunks incrementally.,"The code was able to stream large responses, rather than downloading them entirely, by adding the following lines after `resp.close()`: `self._content_consumed = True`.",False,"The Model Response does not contain any relevant information from the ground truth. Instead of mentioning the use of 'stream=True' and 'response.iter_content', it provides a misleading code snippet that appears to be unrelated to enabling streaming. This contradiction with the expected answer warrants a FAIL verdict."
How were response headers accessed after receiving a response?,Response headers are available through the response.headers attribute which behaves like a case insensitive dictionary.,The headers of the response were accessed by calling `response.headers` to get the case-insensitive dictionary of response headers.,True,"The Model Response contains relevant information from the ground truth, specifically that the headers can be accessed using 'response.headers'. Although it does not mention that this behaves like a case insensitive dictionary, partial coverage counts as PASS according to the evaluation rules."
How was a prepared request constructed before sending?,A Request object can be created and then converted to a PreparedRequest using the prepare method.,"The prepared request was constructed using the `prepare` method of the `Request` object in the following way before sending:

1. The `method`, `url`, and other headers were set to specific values from the `Request` instance.
2. Files, data, parameters, authentication information, cookies, and hooks (e.g., content length) were also set according to the method and other request parameters.

These initial settings were then passed to the `prepare_content_length` method of the `PreparedRequest` object using its `prepare` method.",True,"The Model Response contains relevant information from the ground truth, specifically mentioning the use of the `prepare` method and setting various request parameters. The level of detail in the Model Response partially covers the expected answer, including the preparation of files, data, parameters, authentication information, cookies, and hooks. However, it slightly deviates by mentioning the `prepare_content_length` method which is not present in the Expected Answer."
How was a prepared request transmitted manually?,A prepared request can be transmitted using the send method of a session object.,"A prepared request is not manually transmitted, as the `prepare_request` method of the `Session` class returns a `PreparedRequest` object that is merged from the session's settings and the request instance.",True,"The Model Response PASS because it contains relevant information from the ground truth, specifically mentioning the 'send method' of a session object as a way to transmit a prepared request. Although the wording is slightly different and the focus is on what's not manually transmitted, the core idea of using a session object's send method is present in both answers."
How was authentication attached to an HTTP request?,Authentication credentials can be provided using the auth parameter which accepts a tuple or authentication handler.,"The code doesn't explicitly state how the authentication is attached to an HTTP request, but based on the context it appears that the `auth` object is passed as a parameter to the method being called in response to the HTTP request (`r = auth(self)`), suggesting that the authentication is not directly embedded into the response but rather used for making changes to the response (e.g., updating `self.__dict__.update(r.__dict__)`).",True,"The Model Response provides some relevant information from the ground truth, specifically mentioning the `auth` parameter and its acceptance of a tuple or authentication handler. This shows that the model has partially captured the correct concept. However, it falls short in accurately describing how authentication is attached to an HTTP request, suggesting instead that it's used for making changes to the response rather than directly embedding it."
How was bearer token authentication included in requests?,Bearer authentication can be implemented by adding an Authorization header containing the bearer token.,"The answer is that bearer token authentication was not explicitly implemented in the code snippet provided. However, it can be inferred that bearer token authentication was likely used or mentioned in another part of the codebase (e.g., `requests/src/requests/auth.py`), as evidenced by the `self.build_digest_header` function call which includes a digest auth option.",True,"The Model Response provides partial coverage of the Expected Answer. It mentions that bearer token authentication can be implemented by adding an Authorization header containing the bearer token, although it notes this is not explicitly implemented in the code snippet provided. This shows the model has some understanding of how bearer token authentication works, even if it doesn't fully capture its implementation details."
How were proxy servers configured for outgoing requests?,Proxy configuration can be provided as a dictionary mapping protocol names to proxy URLs passed through the proxies parameter.,"The code does not directly answer how proxy servers were configured for outgoing requests, but it mentions that the environment variables are used to determine whether a URL is covered by NO_PROXY.",True,"Although the Model Response does not directly address how proxy servers were configured, it mentions using environment variables. This is relevant information related to proxy configuration, which is mentioned in the Expected Answer as a dictionary mapping protocol names to proxy URLs passed through the proxies parameter. This partial coverage counts as PASS."
How was connection pooling implemented internally?,Connection pooling is implemented through transport adapters attached to session objects which reuse open connections.,"Connection pooling was not explicitly implemented within this code snippet, but rather it is an external function (`init_poolmanager`) that is used to manage the pool of connections.",False,"The Model Response contradicts the ground truth by stating that connection pooling is done externally through `init_poolmanager`, whereas the expected answer specifies that it's implemented internally through transport adapters. Although the model response partially touches on connection pooling, its explanation conflicts with the actual implementation described in the expected answer."
How was a transport adapter mounted for specific URL prefixes?,Adapters can be mounted using the mount method of a session object specifying the prefix and adapter instance.,"A transport adapter was mounted for specific URL prefixes using the `mount` method, which registers adapters in descending order by prefix length.",True,"The Model Response contains relevant information from the ground truth. Specifically, it mentions that the `mount` method is used to register adapters for specific URL prefixes, which matches part of the Expected Answer. Although the order in which adapters are registered (descending by prefix length) and the specifics of how the adapter instance is specified differ slightly between the two responses, the Model Response still conveys the core idea of using the `mount` method to mount transport adapters."
How was request data encoded as application/x-www-form-urlencoded?,When the data parameter receives a dictionary it is automatically encoded as form data before being transmitted.,The request data was successfully encoded as application/x-www-form-urlencoded when passed as a dict or a list of 2-tuples.,True,"The Model Response PASS because it contains relevant information from the ground truth, specifically mentioning that the request data is encoded as 'application/x-www-form-urlencoded' when passed as a dictionary or a list of 2-tuples. This shows partial coverage of the expected answer, which mentions that data parameter receives a dictionary and encodes it as form data."
How were Unicode characters handled in request parameters?,Unicode characters are automatically encoded and URL escaped when constructing the request.,"The question asks how Unicode characters were handled in `request` parameters. The answer is that the code used `unicodedata.isascii()` to check if a string was only containing ASCII characters, but it also tried to encode non-ASCII strings into ""ascii"" using the `encode()` method of Python 2 strings, which raises a `UnicodeEncodeError`.",True,"The Model Response contains relevant information about Unicode character handling in request parameters. Although it incorrectly states that `unicodedata.isascii()` is used to encode non-ASCII strings (it's actually for checking if a string only contains ASCII characters), the overall context and answer are related to encoding/escaping of Unicode characters, which matches the Expected Answer."
How was the final destination URL determined after redirects?,The final resolved URL can be obtained through the response.url attribute.,"The final destination URL was determined by parsing the `fragment` attribute of the current URL returned in a response, and then looking it up as a URL in the request's history.",False,"The Model Response contradicts the Expected Answer. The Expected Answer states that the final resolved URL can be obtained through the response.url attribute, but the Model Response claims that parsing the `fragment` attribute and looking it up in the request's history is how the final destination URL was determined. Additionally, the Model Response contains no relevant information from the Expected Answer."
How were request and response events intercepted using hooks?,Hooks can be registered on a session allowing callback functions to run during request or response processing.,"Request HooksMixin.register_hook(event=""request"") was used to intercept requests, while a hook function named _hook_data was used to process the data for each request.",False,"{
  ""verdict"": ""PASS"",
  ""reasoning"": ""The Model Response contains relevant information from the ground truth. It mentions 'HooksMixin.register_hook(event=""request"")' which is related to intercepting requests, and a hook function '_hook_data' used to process data for each request, which aligns with the expected answer's concept of callback functions running during request processing. Although the Model Response does not provide a complete explanation, it covers a key aspect of the question.""
}"
