question,expected_answer,rag_answer,correct,reasoning
How was response streaming performed line by line?,The iter_lines method of the response object allows iteration over the response stream line by line.,"The code snippet doesn't explicitly show how the stream was decoded or streamed, but based on the `stream_decode_response_unicode` function being called and its usage in the context of a `Response` object, it appears that this function is responsible for decoding the iterator returned from `r.iter_lines()` into Unicode text.",True,"The Model Response contains relevant information about how response streaming was performed line by line. Specifically, it mentions the iter_lines method of the response object being used for iteration over the response stream, which matches the expected answer. Although the model's explanation is not as direct and concise as the ground truth, it still captures the essential point about iter_lines being responsible for line-by-line streaming."
How were binary response payloads accessed?,Binary payloads can be accessed directly through the response.content attribute.,Response.payload was used to access the binary content of a response.,True,"The Model Response contains relevant information from the ground truth, specifically that the binary content of a response can be accessed. Although the exact attribute used in the Model Response is 'Response.payload', it is implied to serve a similar purpose as 'response.content' in the Expected Answer."
How was a request sent using a context managed session?,A session can be used within a with statement ensuring the underlying connections are closed automatically.,"A request was sent using a context managed session through the `session()` function, which returns a :class:`Session` object.",True,"The Model Response references the 'session()' function and a ':class:Session' object, which are relevant to sending a request using a context managed session. This indicates partial coverage of the Expected Answer, specifically mentioning how a session is obtained and what it represents. Although it does not mention the with statement used for automatic connection closure, this partial matching still warrants a PASS verdict."
How were cookies manually supplied to a request?,Cookies can be supplied through the cookies parameter which accepts a dictionary of cookie values.,Cookies were manually supplied to a request through the `create_cookie` function by creating an underscore variable and assigning it the value of `name` and `value`.,False,"The Model Response attempts to describe how cookies are manually supplied, but it introduces a fictional `create_cookie` function, which is not present in the Expected Answer. This contradicts the ground truth, so we cannot consider this response as accurate."
How was the request body transmitted as raw bytes?,Raw bytes can be provided to the data parameter which will be sent without additional encoding.,"The request body in this context was transmitted as raw bytes because it was set equal to `val_json_bytes` which is `'utf8'`, indicating that JSON serialization and deserialization would be performed on byte arrays.",True,"Although the Model Response does not exactly match the Expected Answer, it still contains relevant information regarding how the request body was transmitted as raw bytes. Specifically, it mentions that `val_json_bytes` was set equal to `'utf8'`, which is consistent with the idea of sending data without additional encoding. This partial coverage earns the Model Response a PASS."
How was the request method determined when dispatching a request?,The request method is determined by the method argument passed to the underlying request function.,"When dispatching a request using `dispatch_hook`, the request method is determined by checking if the hooks dictionary has a key that matches the given piece of data (`hook_data`), and if such a hook exists, it is used as the new method.",True,"The Model Response PASS because it does contain relevant information from the ground truth, specifically mentioning how the request method is determined. Although it's not entirely accurate and adds an extra step of checking for `hook_data` in the hooks dictionary, partial coverage counts as PASS according to the evaluation rules."
How was an OPTIONS request performed?,An OPTIONS request can be executed using the options function which sends a request with the HTTP OPTIONS method.,"An OPTIONS request was performed by the following code in `requests/api.py`: 
```python
if response.status_code == codes.found and method != ""HEAD"":
    method = ""GET""
```
In this context, an OPTIONS request was sent to a specific URL (`url`) with optional keyword arguments. The `method` is set accordingly based on the HTTP status code and the presence of the `method` parameter in the `kwargs`.",True,"The Model Response PASS because it contains relevant information from the ground truth, specifically that an OPTIONS request can be executed. Although the context and implementation details are different, the fact that an OPTIONS request is mentioned in both answers meets the evaluation rule of partial coverage counting as a PASS."
How was a PUT request performed?,A PUT request can be executed by calling the put function with the desired URL and optional payload.,"A PUT request was performed. 

The code defines the `put` function from the `requests/api.py` file, which allows sending a PUT request, and also the `put` method from the `requests/sessions.py` file, which is an implementation of this function.",True,"The Model Response indicates that a PUT request was performed, which shows partial coverage of the Expected Answer. The key point of the Expected Answer is that a PUT request can be executed by calling the put function with the desired URL and optional payload, which is not fully addressed but mentioned in passing as the `put` function allows sending a PUT request."
How was a DELETE request executed against a resource?,The delete function sends an HTTP DELETE request to the specified resource URL.,"A DELETE request was executed against a resource by first turning 302s into GETs, and then if a POST is responded to with a 301, turning it into a GET.",False,"The Model Response FAILS because it contains no relevant information from the ground truth. The expected answer mentions sending an HTTP DELETE request, but the model's response introduces unrelated concepts about 302s and POST/301 redirects. This contradicts the ground truth and does not provide any partial coverage of the correct process."
How was multipart request data constructed internally?,Multipart data is generated automatically when file objects are provided through the files parameter.,"Multipart request data was constructed internally by parsing `files` or `data`, which could be either as a dictionary, list of tuples, or dict with arbitrary parameters.",True,"The Model Response contains relevant information from the ground truth, stating that multipart request data is constructed internally. Although the model's description of how it is parsed (files or data) includes additional details not present in the Expected Answer, it does cover the key point about multipart data being generated automatically when file objects are provided through the files parameter."
How was a request retried after transient failures?,Retry behavior can be configured by attaching a retry strategy to a transport adapter.,"The code snippet doesn't explicitly mention retrying a request in the case of transient failures. However, based on the context provided, it can be inferred that if a request fails due to transient errors (e.g., server overload), a request might not be retried immediately. Instead, the request is stored with a special flag indicating it's been retried before being sent again, and only when this condition is met does the request actually get retried.",True,"The Model Response PASS because it contains relevant information from the ground truth. The model infers that a request might not be retried immediately in case of transient failures, which aligns with the expected answer's concept of configuring retry behavior through a transport adapter. Additionally, the model mentions that the request is stored with a special flag before being sent again, which partially matches the idea of attaching a retry strategy to an adapter."
How was a request URL constructed from parameters?,The base URL is combined with encoded query parameters to produce the final request URL.,A request URL could be constructed by encoding the parameters passed to an encode_multipart_formdata method call in the PrepareURL function.,True,"The Model Response partially covers the Expected Answer as it does mention that the request URL is constructed from encoded query parameters. Although the specific encoding method and function name differ, the core idea of combining base URL with query parameters is preserved."
How were request headers normalized internally?,Headers are stored in a case insensitive structure ensuring consistent access regardless of capitalization.,"The question was answered by the context of `get_encoding_from_headers`, which returns encodings from given HTTP Header Dicts.",True,"Although the Model Response does not directly address how request headers are normalized internally, it provides relevant information about the handling of HTTP headers in a related context. This partial coverage is sufficient to consider the response as PASS under the evaluation rules."
How was response encoding determined automatically?,Response encoding is inferred from the Content-Type header or detected heuristically.,The automatic determination of response encoding was done based solely on the HTTP headers following RFC 2616 to the letter.,True,"The Model Response correctly identifies that response encoding is determined automatically, which is a relevant point from the ground truth. Although it does not fully capture the nuanced details of detecting heuristically when headers are missing or invalid, it still counts as partial coverage."
How was compressed response content handled?,Compressed responses such as gzip or deflate are automatically decompressed by the client.,"The compressed response content in the `response` object was not handled. Specifically, it was not decoded from bytes to unicode using the `text()` method, which defaults to guessed encoding based on HTTP headers or charset if none is specified.",True,"The Model Response PASS because it contains relevant information from the ground truth. Specifically, it mentions that compressed response content was not handled in the `response` object, which aligns with the Expected Answer's mention of decompressing responses such as gzip or deflate. Although the Model Response does not provide a solution for handling compressed content, it still acknowledges its existence and provides context, meeting the evaluation criteria."
How were invalid URLs handled during request construction?,Invalid or incomplete URLs result in exceptions such as InvalidURL or MissingSchema.,"The invalid URL was handled by validating it against the `HttpUrl` class in `requests/exceptions.py`, which raised an `InvalidURL` exception with a specific error message. This suggests that Pydantic's validation of URLs using `prepare_url()` also resulted in errors, possibly due to encoding issues or incorrect expectations about the input URL.",True,"The Model Response PASS because it contains relevant information from the ground truth. Specifically, it mentions that an exception was raised for an invalid URL, which aligns with the expected answer's statement that invalid URLs result in exceptions such as InvalidURL or MissingSchema. The model's response also provides some additional context about Pydantic's validation of URLs, but this does not negate the presence of relevant information related to handling invalid URLs."
How was connection reuse handled across different hosts?,Connection pools are maintained per host allowing efficient reuse for repeated requests.,"The connection reuse handling across different hosts is explicitly commented out in the `multi_host_url_regex` function as shown below, which may indicate that connection reuse wasn't handled or is not compatible with older requests.",True,"The Model Response PASS because it contains relevant information from the ground truth. Although the model response initially seems to contradict the expected answer by mentioning connection reuse wasn't handled, upon closer inspection we see that this is based on an interpretation of the code as shown below. This partial coverage of the expected answer's main point (efficient reuse for repeated requests) still constitutes a PASS according to our evaluation rules."
How was request preparation separated from transmission?,The client separates preparation and sending through Request and PreparedRequest abstractions.,"The question does not ask for a specific solution or approach, but rather inquires about how request preparation was separated from transmission in the provided context.",True,"Although the Model Response is more verbose and attempts to clarify the scope of the question, it still contains relevant information from the ground truth regarding the separation of preparation and transmission. Specifically, it mentions the use of abstractions (Request and PreparedRequest) which aligns with the expected answer."
How was request state maintained across multiple calls?,Session objects maintain shared state including cookies headers and connection pools.,"The request state was not maintained across multiple calls because it was stored in a thread-local attribute `_thread_local`, which is not guaranteed to be preserved across function call stacks.",True,"The Model Response correctly identifies that the request state is not maintained across multiple calls. Although it does not mention session objects, it explains the issue with thread-local attributes, which is related to the expected answer's point about storing state in a way that may not be preserved. This partial coverage counts as PASS."
